{"version":1,"batch":20,"mode":"offline-program-closeout","status":"in-progress","attestation_contract_version":"continuity-attestation-v1","closeout_contract_version":"program-closeout-v1","approved_batch19_attestation_hash":"844a9499af7888bfac2e8f860ebb3e62c5688250758ff7fc96510f57d30a92f0","rejection_codes":["invalid-input","attestation-unpinned","evidence-incomplete","findings-open","approval-incomplete","retention-invalid","release-enabled"],"safety":{"fail_closed":true,"attestation_pinned":true,"independent_approval_required":true,"production_data_allowed":false,"deployment_authorized":false,"database_changes":false,"cohort_changes":false},"fixtures":[{"fixture_ref":"closeout-ready","expected_decision":"closed","input":{"batch19_attestation":{"attestation_contract_version":"continuity-attestation-v1","recovery_hash":"ddd1acf2068a45abe5d88c1778e085e5ee5c4e62c22b054a5ad74a52099960ad","attestation":{"rto_target_minutes":60,"rto_observed_minutes":30,"rpo_target_objects":0,"rpo_observed_objects":0,"open_critical_findings":0,"signoffs":[{"signer_ref":"signer-synthetic-continuity","role":"continuity-owner","approved":true,"evidence_ref":"attestation-evidence-synthetic-continuity"},{"signer_ref":"signer-synthetic-audit","role":"audit-reviewer","approved":true,"evidence_ref":"attestation-evidence-synthetic-audit"}],"next_drill_days":90,"production_access":false,"deployment_authorized":false,"writeback":false},"release_authorized":false,"attestation_hash":"844a9499af7888bfac2e8f860ebb3e62c5688250758ff7fc96510f57d30a92f0"},"closeout":{"evidence_hashes":["1111111111111111111111111111111111111111111111111111111111111111","2222222222222222222222222222222222222222222222222222222222222222","3333333333333333333333333333333333333333333333333333333333333333"],"unresolved_findings":0,"approvals":[{"approver_ref":"approver-synthetic-program","role":"program-owner","approved":true,"evidence_ref":"closeout-evidence-synthetic-program"},{"approver_ref":"approver-synthetic-audit","role":"audit-reviewer","approved":true,"evidence_ref":"closeout-evidence-synthetic-audit"}],"retention_days":365,"disposition":"archived-not-released","release_authorized":false,"deployment_authorized":false,"writeback":false}}},{"fixture_ref":"bad-attestation","expected_decision":"invalid","expected_code":"attestation-unpinned","input":{"source_fixture_ref":"closeout-ready","mutation":"attestation"}},{"fixture_ref":"bad-evidence","expected_decision":"invalid","expected_code":"evidence-incomplete","input":{"source_fixture_ref":"closeout-ready","mutation":"evidence"}},{"fixture_ref":"bad-finding","expected_decision":"invalid","expected_code":"findings-open","input":{"source_fixture_ref":"closeout-ready","mutation":"finding"}},{"fixture_ref":"bad-approval","expected_decision":"invalid","expected_code":"approval-incomplete","input":{"source_fixture_ref":"closeout-ready","mutation":"approval"}},{"fixture_ref":"bad-retention","expected_decision":"invalid","expected_code":"retention-invalid","input":{"source_fixture_ref":"closeout-ready","mutation":"retention"}},{"fixture_ref":"bad-release","expected_decision":"invalid","expected_code":"release-enabled","input":{"source_fixture_ref":"closeout-ready","mutation":"release"}}],"evidence_ref":"docs/BATCH_20_PROGRAM_CLOSEOUT.md"}
